"","name.x","created","city","state","members","who","id.x","gid","category","id.y","name.y","yes_rsvp_count","lat","lon"
"1","The Greater Boston Area Weblogger Meetup Group",1034097731000,"Cambridge","MA",100,"Bloggers",21458,21458,"tech",NA,NA,NA,NA,NA
"2","The Boston Bookcrossing Meetup Group",1034097745000,"Cambridge","MA",511,"BookCrossers",23495,23495,"book clubs",NA,NA,NA,NA,NA
"3","The Boston Atheists Meetup Group",1035261083000,"Boston","MA",1508,"Freethinkers",12763,12763,"religion/beliefs",NA,NA,NA,NA,NA
"4","The Boston Java Meetup Group",1037127220000,"Cambridge","MA",2643,"Java Developers",87071,87071,"tech",NA,NA,NA,NA,NA
"5","The Boston French Language Meetup Group",1037728347000,"Cambridge","MA",2835,"French Speakers",63770,63770,"language/ethnic identity",NA,NA,NA,NA,NA
"6","Boston Writers' Workshop",1038445733000,"Boston","MA",790,"Writers",122206,122206,"writing",NA,NA,NA,NA,NA
"7","The Boston Pug Meetup Group",1039143409000,"Boston","MA",1006,"Pug Devotee Extraordinaires",126274,126274,"pets/animals",NA,NA,NA,NA,NA
"8","Boston Vegan Meetup Group",1039719611000,"Boston","MA",664,"Boston Area Vegans",160867,160867,"health/wellbeing",NA,NA,NA,NA,NA
"9","Boston Vegetarian Meetup",1040267801000,"Cambridge","MA",462,"Vegetarians",161153,161153,"food/drink",NA,NA,NA,NA,NA
"10","Boston Design Talks",1040699604000,"Boston","MA",983,"Designers",71144,71144,"career/business",NA,NA,NA,NA,NA
"11","Boston PHP",1041130024000,"Boston","MA",3753,"Members",120818,120818,"tech",NA,NA,NA,NA,NA
"12","Boston Republican Meetup Group",1041604037000,"Boston","MA",628,"Boston Republicans",131129,131129,"movements/politics",NA,NA,NA,NA,NA
"13","The Boston Spanish Language Meetup Group",1042056761000,"Cambridge","MA",5112,"Spanish Speakers",145862,145862,"language/ethnic identity",NA,NA,NA,NA,NA
"14","Boston Japanese & English Language Club",1042101769000,"Cambridge","MA",2385,"Japanese/English Speakers",86694,86694,"language/ethnic identity","fddkhnywpblc","Tuesday Night Conversation Group @ Super 88",6,42.352218,-71.124109
"15","Boston Web Design (and Dev) Meetup Group",1042827112000,"Boston","MA",1667,"Web Professionals",163691,163691,"tech",NA,NA,NA,NA,NA
"16","Boston Integral Commons (Ken Wilber group)",1043464256000,"Newton Center","MA",289,"members",91062,91062,"new age/spirituality",NA,NA,NA,NA,NA
"17","Democracy for America: Massachusetts",1043936393000,"Boston","MA",890,"Activists",171526,171526,"movements/politics",NA,NA,NA,NA,NA
"18","Boston Photo Center",1044805481000,"Boston","MA",2,"BPC Members",120095,120095,"photography",NA,NA,NA,NA,NA
"19","The Boston English as a Second Language (ESL) Meetup Group",1044916688000,"Boston","MA",3252,"English Learners",55264,55264,"language/ethnic identity",NA,NA,NA,NA,NA
"20","German Expatriates in Boston  Meetup",1046997673000,"Boston","MA",713,"German expatriates",57664,57664,"language/ethnic identity","kzzpmlywpbdc","German Expatriates in Boston  Meetup Monthly Meetup",18,NA,NA
"21","The Boston Science Fiction & Fantasy Writers Meetup Group",1048446038000,"Newton Center","MA",636,"SF Writers",137807,137807,"writing",NA,NA,NA,NA,NA
"22","The Boston Jazz Meetup Group",1048870241000,"Boston","MA",970,"Jazz Fans",87187,87187,"music",NA,NA,NA,NA,NA
"23","MA Korean Language & Culture Group",1050960924000,"Boston","MA",712,"members",92243,92243,"language/ethnic identity",NA,NA,NA,NA,NA
"24","The Boston Democratic Party Meetup Group",1051303643000,"Boston","MA",244,"Democrats",171097,171097,"movements/politics",NA,NA,NA,NA,NA
"25","The Boston Mandarin Chinese Language Meetup Group",1052156228000,"Boston","MA",1917,"Boston Mandarin Meetup Members",33097,33097,"language/ethnic identity",NA,NA,NA,NA,NA
"26","Boston Thoughtful World-Transforming Abolitionist Vegans",1063859039000,"Boston","MA",77,"Keen World-Transforming Vegans",161350,161350,"food/drink",NA,NA,NA,NA,NA
"27","Boston Investor's Group",1063864734000,"Cambridge","MA",2916,"Investor$ who think 4 themselve$",81154,81154,"career/business","245256194","Special Speakers Meeting: Robert Sherfke of Wellington Management",57,42.360073,-71.08471
"28","Boston Civil Liberties Task Force",1066858789000,"Boston","MA",75,"civil liberties supporters",2348,2348,"socializing",NA,NA,NA,NA,NA
"29","The Boston Expat Canadian Meetup Group",1066858789000,"Boston","MA",1182,"Expat Canadians",29048,29048,"language/ethnic identity","245291651","Nova Scotia/Boston Christmas Tree Lighting Pre-Party",14,42.350037,-71.130592
"30","Boston Skype Philosophy Meetup Group",1066858789000,"Cambridge","MA",569,"Philosophers",119696,119696,"education/learning",NA,NA,NA,NA,NA
"31","The Boston Wine Meetup Group",1066858789000,"Boston","MA",1632,"Wine Enthusiasts",166097,166097,"food/drink",NA,NA,NA,NA,NA
"32","The Boston Black Professionals Meetup Group",1068227877000,"Boston","MA",282,"MA Professionals",21248,21248,"career/business",NA,NA,NA,NA,NA
"33","The Boston Attention Deficit Disorder Meetup Group",1071173171000,"Allston","MA",618,"ADDers",3092,3092,"support",NA,NA,NA,NA,NA
"34","The Boston Fashion Meetup Group",1072705527000,"Boston","MA",1430,"Fashion Entrepreneurs",59186,59186,"career/business","245170011","FGI'S WINTER 2018 READY TO WEAR TREND REPORT & NETWORKING MIXER",15,42.350948,-71.04364
"35","The Boston Sailing Meetup Group",1080337893000,"Jamaica Plain","MA",1925,"Boston Sailing Meetup Members",135687,135687,"outdoors/adventure",NA,NA,NA,NA,NA
"36","Boston Nightlife",1080876025000,"Boston","MA",7014,"Friends",111392,111392,"socializing",NA,NA,NA,NA,NA
"37","Boston Biotech",1097368029000,"Boston","MA",3567,"Members",178843,178843,"tech",NA,NA,NA,NA,NA
"38","madfemmepride: friendly, diverse, queer/femme community :)",1109633200000,"Boston","MA",5194,"all grrrls, bois, & femmes",197758,197758,"LGBT",NA,NA,NA,NA,NA
"39","The Boston Plone Meetup Group",1125524281000,"Cambridge","MA",63,"Plonista",207992,207992,"tech",NA,NA,NA,NA,NA
"40","The Boston MySQL Meetup Group",1130438871000,"Boston","MA",1512,"Boston-Metro MySQL Users",212864,212864,"tech",NA,NA,NA,NA,NA
"41","Boston Karaoke Meetup",1130533178000,"Boston","MA",877,"Karaoke Singers",212993,212993,"music",NA,NA,NA,NA,NA
"42","The Boston French Bulldog Meetup Group",1131144203000,"Boston","MA",676,"French Bulldog Owners & Lovers",213526,213526,"pets/animals",NA,NA,NA,NA,NA
"43","Boston Futurology & Transhumanism",1134403069000,"Cambridge","MA",364,"Members",216208,216208,"education/learning",NA,NA,NA,NA,NA
"44","Reading books by international writers",1135197087000,"Brookline","MA",458,"International Book Readers",216983,216983,"book clubs",NA,NA,NA,NA,NA
"45","Boston Urban Exploration and Adventuring",1135897886000,"Boston","MA",498,"Explorers",217702,217702,"outdoors/adventure",NA,NA,NA,NA,NA
"46","Boston Area Alternative Energy Supporters",1136861198000,"Boston","MA",517,"Alternative Energy Supporters",219161,219161,"community/environment",NA,NA,NA,NA,NA
"47","The Cambridge Search Engine Optimization Meetup Group",1137185508000,"Arlington","MA",1645,"People Interested in SEO/SEM",219718,219718,"tech",NA,NA,NA,NA,NA
"48","New England Aussies",1138828158000,"Boston","MA",5,"Characters",222356,222356,"language/ethnic identity",NA,NA,NA,NA,NA
"49","Boston Movie Group",1140735210000,"Boston","MA",5887,"Movie Fans",225256,225256,"movies/film",NA,NA,NA,NA,NA
"50","The Boston Hiking Meetup Group",1143140754000,"Cambridge","MA",8438,"Hikers",229835,229835,"outdoors/adventure",NA,NA,NA,NA,NA
"51","Revolve Nation's Boston Entrepreneur Group",1144455692000,"Boston","MA",4095,"Entrepreneurs",232461,232461,"career/business",NA,NA,NA,NA,NA
"52","The Boston Metal Meetup Group",1145846837000,"Waltham","MA",331,"Metalheads",235213,235213,"music",NA,NA,NA,NA,NA
"53","The Boston Dungeons & Dragons Meetup Group",1147291541000,"Boston","MA",2254,"D&D Players",244439,244439,"games",NA,NA,NA,NA,NA
"54","The Boston German Language Meetup Group",1148502477000,"Cambridge","MA",1762,"German Speakers",252130,252130,"language/ethnic identity",NA,NA,NA,NA,NA
"55","The Boston Gay Professionals Meetup Group",1150598018000,"Boston","MA",3518,"Gay Professionals",266831,266831,"career/business",NA,NA,NA,NA,NA
"56","Breakfast, Brunch, Lunch, & Dinner Meetup Group",1151547203000,"Boston","MA",2216,"Fellow Foodies",273555,273555,"food/drink",NA,NA,NA,NA,NA
"57","The Boston & Cambridge Salsa Meetup Group",1152225932000,"Cambridge","MA",4828,"Salsa Fans",278345,278345,"dancing",NA,NA,NA,NA,NA
"58","Boston Italian Language and Culture",1153577535000,"Boston","MA",204,"Members of this group",288923,288923,"language/ethnic identity",NA,NA,NA,NA,NA
"59","Socializing for Justice",1154919590000,"Boston","MA",3116,"SoJusters",299655,299655,"community/environment",NA,NA,NA,NA,NA
"60","Spirituality & Mysticism Meetup Group",1155267198000,"Cambridge","MA",905,"Mystics",302540,302540,"new age/spirituality",NA,NA,NA,NA,NA
"61","Multifamily Apartment Investing - Subgroup Of Boston REIA",1155332792000,"Dedham","MA",865,"Boston RE Investors",302998,302998,"career/business",NA,NA,NA,NA,NA
"62","The Boston Digital Arts Meetup Group",1155342275000,"Boston","MA",459,"Digital Artists",303063,303063,"photography",NA,NA,NA,NA,NA
"63","The Brookline & Boston Abuse Survivors Meetup Group",1155563186000,"Brookline","MA",507,"Abuse Survivors",304528,304528,"support",NA,NA,NA,NA,NA
"64","The Boston Little Yorkies Meetup Group",1155773240000,"Boston","MA",180,"Little Yorkie Lovers",306386,306386,"pets/animals",NA,NA,NA,NA,NA
"65","Boston International/Arthouse Movie Meetup Group",1155954187000,"Boston","MA",227,"people",307808,307808,"movies/film",NA,NA,NA,NA,NA
"66","Boston/Providence Single Parents",1156290834000,"Milton","MA",997,"Single Parents",310263,310263,"parents/family",NA,NA,NA,NA,NA
"67","Eastern Massachusetts Motherless Daughters",1157505665000,"Boston","MA",321,"Motherless Daughters",319099,319099,"support",NA,NA,NA,NA,NA
"68","New England Meetup Organizers",1157755116000,"Waltham","MA",107,"Organizers",321127,321127,"socializing",NA,NA,NA,NA,NA
"69","The Boston Philosophy of Mind Group",1159109925000,"Boston","MA",531,"Philosophers",331299,331299,"education/learning",NA,NA,NA,NA,NA
"70","App Devs + Entrepreneurs",1159201082000,"Boston","MA",3871,"App Devs + Entrepreneurs",331893,331893,"tech",NA,NA,NA,NA,NA
"71","Jack Russell Terrier Boston Area Group",1160224073000,"Brookline","MA",241,"JRT OWNERS",339624,339624,"pets/animals",NA,NA,NA,NA,NA
"72","Boston Walking Meetup Group",1160435228000,"Brookline","MA",3160,"social walkers",341292,341292,"outdoors/adventure","245322617","Weekly Multigroup Community Walk at Fresh Pond + dinner 11/26 3:30pm",11,42.378754,-71.147324
"73","Conscious Movie Meetup!",1162174450000,"Cambridge","MA",265,"Consciousness movie members",355065,355065,"movies/film",NA,NA,NA,NA,NA
"74","Real Estate Networking/Education Meeting in Boston",1162574529000,"Boston","MA",764,"Serious Real Estate Investors",358354,358354,"career/business",NA,NA,NA,NA,NA
"75","Greater Boston Mental Health Professionals",1162764978000,"Newton","MA",361,"Mental health professionals",359624,359624,"health/wellbeing",NA,NA,NA,NA,NA
"76","Tabletop Role Play Society of Boston",1162773814000,"Cambridge","MA",525,"Gamers",359705,359705,"games","244524413","Pathfinder Society Gaming at Knight Moves Cafe (Brookline)",3,42.34145,-71.125008
"77","The Boston Law of Attraction Meetup Group",1163874375000,"Boston","MA",2586,"Law of Attraction Co-Creators",368525,368525,"new age/spirituality",NA,NA,NA,NA,NA
"78","The Cambridge Moveable Feast",1164140077000,"Cambridge","MA",2684,"Citizens of the World",370532,370532,"socializing","243060147","African American Folktales ... (Henry Louis Gates, Jr.) ...",9,42.346428,-71.08993
"79","Boston & Cambridge Ethnic Dining",1164213872000,"Cambridge","MA",3037,"Explorers of ethnic cuisines",371060,371060,"food/drink",NA,NA,NA,NA,NA
"80","Wayland Cribbage!",1165379039000,"Waltham","MA",135,"Cribbage Players",378600,378600,"games",NA,NA,NA,NA,NA
"81","Twisted Touring",1165466485000,"Cambridge","MA",35,"Twisted Tourists",379328,379328,"cars/motorcycles",NA,NA,NA,NA,NA
"82","Tantra International",1166119868000,"Boston","MA",195,"Tantra Practitioners/Teachers",383662,383662,"new age/spirituality",NA,NA,NA,NA,NA
"83","We Are Change Boston /Boston Alternative Media- Journalism",1166982635000,"Boston","MA",252,"""Members""",388713,388713,"movements/politics",NA,NA,NA,NA,NA
"84","Boston Webmasters Meetup Group",1167366728000,"Boston","MA",205,"Web Professionals",391084,391084,"tech",NA,NA,NA,NA,NA
"85","Ciné Club Francophone de Boston",1168523042000,"Brookline","MA",708,"Amis du ciné club",401467,401467,"movies/film",NA,NA,NA,NA,NA
"86","Rock and Ice Climbing Boston",1169007687000,"Cambridge","MA",2993,"Climbers",406080,406080,"outdoors/adventure",NA,NA,NA,NA,NA
"87","New England Artists/Models Group",1169241652000,"Boston","MA",1472,"Art Models and Artists",408475,408475,"fine arts/culture",NA,NA,NA,NA,NA
"88","The Boston Beanstalks Tall Club",1169420697000,"Boston","MA",173,"Beanstalks and their Friends",410040,410040,"socializing",NA,NA,NA,NA,NA
"89","The Boston Gay Women's Meetup Group",1169853140000,"Boston","MA",4269,"women",414342,414342,"LGBT",NA,NA,NA,NA,NA
"90","The Greater Boston Wiccan  Meetup",1170001494000,"Cambridge","MA",496,"Wiccans",415488,415488,"religion/beliefs",NA,NA,NA,NA,NA
"91","Mosaic Jewish Outdoor Club of Massachusetts",1170120332000,"Brookline","MA",751,"friends and members",416725,416725,"outdoors/adventure",NA,NA,NA,NA,NA
"92","The Web Content Management Systems Meetup Group",1170726764000,"Cambridge","MA",549,"People interested in CMS",422397,422397,"tech",NA,NA,NA,NA,NA
"93","Jewish Singles 55+  of Greater Boston",1171034192000,"Dedham","MA",160,"Members",425314,425314,"socializing",NA,NA,NA,NA,NA
"94","The Boston Asian Professionals Meetup Group",1171747225000,"Boston","MA",3746,"Boston Asian Professionals",431528,431528,"language/ethnic identity",NA,NA,NA,NA,NA
"95","The Somerville Tennis Meetup Group",1171911951000,"Somerville","MA",1514,"Tennis Players",432728,432728,"sports/recreation",NA,NA,NA,NA,NA
"96","Boston Area Social Anxiety Meetup",1172161576000,"Cambridge","MA",1667,"People",435114,435114,"socializing",NA,NA,NA,NA,NA
"97","Boston Live Music",1173143620000,"Boston","MA",10240,"Fans of Live Music",444171,444171,"music",NA,NA,NA,NA,NA
"98","Boston Area Motorcycle Riders",1173286322000,"Boston","MA",110,"Motorcycle Riders",445524,445524,"cars/motorcycles",NA,NA,NA,NA,NA
"99","The Boston/Cambridge Portuguese Language Meetup Group",1174263714000,"Cambridge","MA",1348,"Portuguese Speakers",454600,454600,"language/ethnic identity",NA,NA,NA,NA,NA
"100","Date Me I'm Jewish",1175013203000,"Brookline","MA",341,"Members",461164,461164,"parents/family",NA,NA,NA,NA,NA
"101","EuroBoston - The Boston European Social Network",1175643538000,"Boston","MA",713,"EuroB's",467296,467296,"language/ethnic identity",NA,NA,NA,NA,NA
"102","The Boston Python User Group",1175867048000,"Cambridge","MA",7505,"Pythonistas",469457,469457,"tech",NA,NA,NA,NA,NA
"103","The Cambridge Improv incubator",1176165209000,"Cambridge","MA",1189,"Improv & Performance Artists",472156,472156,"fine arts/culture",NA,NA,NA,NA,NA
"104","Greater Boston Cycling/Outdoor Fitness Group",1177285765000,"Waltham","MA",2610,"Bicyclists",482869,482869,"fitness",NA,NA,NA,NA,NA
"105","Random Group of Hikers",1178284310000,"Boston","MA",5769,"Randomites",492954,492954,"outdoors/adventure",NA,NA,NA,NA,NA
"106","Boston Frisbee",1179175038000,"Boston","MA",4028,"Flatballers",501407,501407,"fitness",NA,NA,NA,NA,NA
"107","The Arlington Martial Arts Meetup Group",1179251068000,"Arlington","MA",263,"Martial Artists",502152,502152,"sports/recreation",NA,NA,NA,NA,NA
"108","Informal Running Club: Home of TMIRCE:BOS",1179282543000,"Boston","MA",3365,"Llama's",502534,502534,"fitness",NA,NA,NA,NA,NA
"109","Election 2016 -  BLANK THE BALLOT!",1179414181000,"Boston","MA",371,"Blank The Ballot Supporters",504022,504022,"movements/politics",NA,NA,NA,NA,NA
"110","Boston Happy Hour",1179512474000,"Boston","MA",5066,"Drinking Buddies",505098,505098,"socializing",NA,NA,NA,NA,NA
"111","20ish & 30ish Boston Book Club",1179761947000,"Boston","MA",3319,"Book Readers",507213,507213,"book clubs",NA,NA,NA,NA,NA
"112","Cavalier King Charles Spaniel Lovers of Massachusetts",1180017754000,"Boston","MA",477,"Cavalier Lovers",510192,510192,"pets/animals",NA,NA,NA,NA,NA
"113","The Boston Healers Network",1180109374000,"Boston","MA",1809,"Members",511093,511093,"health/wellbeing","245264266","Truly Healthy Bones, More Than Just Calcium and Vitamin D",3,42.3577,-71.23988
"114","Classic Books: A Book Club for Voracious Readers",1180966730000,"Cambridge","MA",1938,"Book Club Readers",518343,518343,"book clubs",NA,NA,NA,NA,NA
"115","Beantown Gamers",1181222819000,"Cambridge","MA",2940,"Board Gamers",521103,521103,"games","cwbltlywpbmc","Weekly Game Night (Wednesday)",17,42.361622,-71.086624
"116","Beantown Gamers",1181222819000,"Cambridge","MA",2940,"Board Gamers",521103,521103,"games","vkhrllywpbmc","Lighter Game Night (Wednesday)",8,42.362549,-71.087036
"117","Boston Leisure Bicycling",1181849374000,"Waltham","MA",1850,"Leisure Bicyclists",527341,527341,"outdoors/adventure",NA,NA,NA,NA,NA
"118","Voulez-vous français Meetup Group",1182965205000,"Boston","MA",3358,"Francophones",541017,541017,"language/ethnic identity",NA,NA,NA,NA,NA
"119","The Boston Ex-Midwesterners Meetup Group",1183239087000,"Boston","MA",573,"Ex-Midwesterners",545362,545362,"socializing",NA,NA,NA,NA,NA
"120","The Boston Area Real Estate Investors Association",1183570978000,"Boston","MA",963,"Boston Area Investors",551165,551165,"career/business",NA,NA,NA,NA,NA
"121","Beantown and Beyond 25-40 Something Singles",1183689712000,"Boston","MA",3192,"Friends",553596,553596,"socializing","245085543","Profitable Networking Boston Event {Complimentary Appetizers}",35,0,0
"122","The North-of-Boston Law of Attraction Meetup Group",1184359903000,"Wakefield","MA",870,"Conscious Creators",567480,567480,"new age/spirituality",NA,NA,NA,NA,NA
"123","Boston Skating",1184445502000,"Boston","MA",423,"Inline / Roller / Ice Skaters",569309,569309,"outdoors/adventure",NA,NA,NA,NA,NA
"124","Boston World Music Meetup Group",1184783172000,"Boston","MA",596,"World Music Fans",575464,575464,"socializing",NA,NA,NA,NA,NA
"125","Massachusetts Plein Air Artists Group",1184850544000,"Winchester","MA",396,"Artists",576650,576650,"fine arts/culture",NA,NA,NA,NA,NA
"126","The Boston Paddling Meetup Group",1185155436000,"Boston","MA",812,"Paddlers",582176,582176,"outdoors/adventure",NA,NA,NA,NA,NA
"127","Boston Volleyball Group",1185306680000,"Cambridge","MA",3383,"Volleyball players",585043,585043,"sports/recreation","245308042","11/28 Intermediate+ Indoor Volleyball East Boston",12,NA,NA
"128","Nonprofit Connector",1185669583000,"Boston","MA",1583,"Positive Changemakers",591859,591859,"community/environment",NA,NA,NA,NA,NA
"129","The Boston Area Libertarian Meetup Group",1185761834000,"Boston","MA",505,"Libertarians",593245,593245,"movements/politics","244554323","Boston Area Libertarian Meetup",4,NA,NA
"130","Boston Real Estate",1185930205000,"Boston","MA",697,"Real Estate Entrepreneurs",596743,596743,"career/business",NA,NA,NA,NA,NA
"131","Indians in Boston",1186603332000,"Boston","MA",1379,"friends",610218,610218,"socializing",NA,NA,NA,NA,NA
"132","Boston Co-Ed Flag Football",1187102777000,"Cambridge","MA",2084,"Flag Football Players",621930,621930,"sports/recreation",NA,NA,NA,NA,NA
"133","Multi-Meetup Dance Parties",1187624311000,"Somerville","MA",3167,"Dancing Fools",635019,635019,"singles",NA,NA,NA,NA,NA
"134","The Boston Green Business Networking Group",1188483217000,"Milton","MA",394,"Energy Entrepreneurs",654497,654497,"community/environment",NA,NA,NA,NA,NA
"135","Nerd Fun - Boston",1188843684000,"Boston","MA",14262,"people",661701,661701,"socializing","243286644","Games at Player 1 Player 2",4,42.346989,-71.043579
"136","Sistah Circle - Bookclub & Circle of Friends",1188935340000,"Boston","MA",102,"Sistah Friend",663460,663460,"language/ethnic identity",NA,NA,NA,NA,NA
"137","Indie Rock Boston",1189618163000,"Brighton","MA",3411,"Fans of Live Music Shows",679091,679091,"music",NA,NA,NA,NA,NA
"138","Ex-Southerners Meetup Group - Boston Region",1189630375000,"Boston","MA",318,"Ex-Southerners",679749,679749,"socializing",NA,NA,NA,NA,NA
"139","Wedeln Ski and Outdoors Club",1189913538000,"Boston","MA",1155,"Wedelns",687583,687583,"outdoors/adventure",NA,NA,NA,NA,NA
"140","The Boston Millionaire Total Empowerment Meetup Group",1190130604000,"Boston","MA",307,"Millionaires",692993,692993,"new age/spirituality",NA,NA,NA,NA,NA
"141","Architects + Interior Designers",1190251756000,"Boston","MA",1071,"Professionals",696342,696342,"career/business",NA,NA,NA,NA,NA
"142","Boston Queer Adventurers",1190595294000,"Somerville","MA",2457,"Adventurers",704086,704086,"outdoors/adventure",NA,NA,NA,NA,NA
"143","Small Doggy PlayDates --for small breeds only",1191432114000,"Waltham","MA",887,"Small Dog Lovers",727218,727218,"pets/animals",NA,NA,NA,NA,NA
"144","Boston N E Raw-food",1191615749000,"Cambridge","MA",1774,"RawⓋ&curious",733136,733136,"food/drink",NA,NA,NA,NA,NA
"145","The Surfing Meetup Group",1191787298000,"Somerville","MA",1760,"Surfers",737305,737305,"outdoors/adventure",NA,NA,NA,NA,NA
"146","Boston New Technology",1193170472000,"Boston","MA",16672,"New Technologists",771580,771580,"tech",NA,NA,NA,NA,NA
"147","Boston Singles ~40 Plus",1193851326000,"Cambridge","MA",408,"Socialites",787760,787760,"singles",NA,NA,NA,NA,NA
"148","Boston/North Shore Martial Arts Meetup Group",1194367224000,"Boston","MA",726,"Martial Artists",800996,800996,"career/business",NA,NA,NA,NA,NA
"149","New England Tantric Meetup",1194493392000,"Boston","MA",2290,"Tantra Seekers",804252,804252,"new age/spirituality",NA,NA,NA,NA,NA
"150","Boston Portrait Photographers",1195577460000,"Cambridge","MA",1035,"Photographers, Models & MUA",830833,830833,"photography",NA,NA,NA,NA,NA
"151","Boston Airliner Spotters Meetup Group",1196802909000,"Boston","MA",374,"Plane Nuts",858146,858146,"career/business",NA,NA,NA,NA,NA
"152","Open House",1196910627000,"Boston","MA",3218,"Members",860845,860845,"socializing",NA,NA,NA,NA,NA
"153","Boston Electronic Dance Music",1196924921000,"Boston","MA",3211,"EDM Lovers",861021,861021,"music",NA,NA,NA,NA,NA
"154","Evening Walkers",1197152036000,"Dedham","MA",877,"Walkers",865474,865474,"outdoors/adventure",NA,NA,NA,NA,NA
"155","Election 2016-Blank The Ballot!",1197475541000,"Boston","MA",49,"Ron Paul Supporters",872268,872268,"movements/politics",NA,NA,NA,NA,NA
"156","Boston ""Onyxbirds"" Travel Group",1197747806000,"Boston","MA",1218,"Onyxbirds",877771,877771,"socializing",NA,NA,NA,NA,NA
"157","BostonJS",1198023423000,"Boston","MA",4029,"JavaScripters",884541,884541,"tech",NA,NA,NA,NA,NA
"158","Boston Drum Circle",1198131993000,"Arlington","MA",1332,"Drummers",886763,886763,"music",NA,NA,NA,NA,NA
"159","Boston Creative Photographers",1199386407000,"Boston","MA",386,"Creative People",919281,919281,"photography",NA,NA,NA,NA,NA
"160","Social Fun",1200316050000,"Boston","MA",12740,"Members",950281,950281,"socializing","244928687","🎄Tree Lighting ",23,42.35685,-71.06202
"161","Technology Job Seekers Greater Boston",1200594205000,"Boston","MA",2155,"Professionals",957397,957397,"tech",NA,NA,NA,NA,NA
"162","Tools for Decluttering, Personal Change & Goal Attainment",1200806521000,"Cambridge","MA",276,"Accountability Buddies",963536,963536,"support",NA,NA,NA,NA,NA
"163","MassMobile - Mobile Developers' Meetup",1200979008000,"Boston","MA",1035,"Software Developers",967348,967348,"tech",NA,NA,NA,NA,NA
"164","Intriguing Lives",1201473774000,"Dedham","MA",432,"Explorers",979502,979502,"socializing",NA,NA,NA,NA,NA
"165","Boston Traders Meetup to Teach/Learn Trading Strategies",1201548457000,"Boston","MA",993,"Traders",981165,981165,"career/business",NA,NA,NA,NA,NA
"166","Interactive Marketing & Advertising",1201708588000,"Cambridge","MA",45,"Marketing Professionals",984032,984032,"career/business",NA,NA,NA,NA,NA
"167","Fun Events with Alcohol!",1201787501000,"Cambridge","MA",3139,"Members",985138,985138,"socializing",NA,NA,NA,NA,NA
"168","The Boston Dyke March",1202355912000,"Boston","MA",1587,"Friends of the Boston Dyke March",997856,997856,"LGBT",NA,NA,NA,NA,NA
"169","Women in Business Network",1202357989000,"Boston","MA",327,"Professional Women",997886,997886,"career/business",NA,NA,NA,NA,NA
"170","Suburban Naturalists",1202681156000,"Newton","MA",1147,"Subnats",1005141,1005141,"community/environment",NA,NA,NA,NA,NA
"171","Meet, Mix and Mingle Boston..Make New Friends!",1204259064000,"Boston","MA",2270,"folks",1037548,1037548,"singles",NA,NA,NA,NA,NA
"172","Cohousing New England:Boston to Burlington/MA,ME,VT,NH,CT,NY",1204941964000,"Cambridge","MA",435,"Cohousers & Community Seekers",1051028,1051028,"community/environment",NA,NA,NA,NA,NA
"173","Boston Couples",1205088847000,"Boston","MA",2099,"Couples",1053816,1053816,"socializing",NA,NA,NA,NA,NA
"174","Vocal Revolution Men's Chorus",1205591261000,"Lexington","MA",137,"Singers",1064944,1064944,"music",NA,NA,NA,NA,NA
"175","The New England Greek Meetup Group",1206325440000,"Boston","MA",422,"New England Greek Meetup Group",1076847,1076847,"language/ethnic identity",NA,NA,NA,NA,NA
"176","The Science of Spirituality Meditation Meetup",1206635741000,"West Newton","MA",273,"Meditators",1082356,1082356,"food/drink",NA,NA,NA,NA,NA
"177","The Cambridge and Boston Social Meetup",1207347332000,"Boston","MA",6759,"Socialites",1096649,1096649,"socializing",NA,NA,NA,NA,NA
"178","Red Sox Natives",1207451446000,"Boston","MA",945,"Natives",1098392,1098392,"socializing",NA,NA,NA,NA,NA
"179","Boston Opera Meetup",1207529155000,"Boston","MA",1511,"Opera Enthusiasts",1099634,1099634,"music",NA,NA,NA,NA,NA
